{
  "topic": "Spec-driven development workflow for breaking down todo.md into small, individual specs",
  "focus_areas": [
    "spec decomposition best practices",
    "specs folder structure and naming conventions",
    "spec lifecycle (draft/active/done)",
    "integration with this repo's workflows/*.js pipeline and todo.md backlog"
  ],
  "current_baseline": "User currently has Claude Code read todo.md directly and work tasks from it. This works but Claude Code can effectively handle only one big task at a time per session, which causes scope creep and large diffs. User wants to switch to spec-driven development: one small task per spec file in a specs/ folder, so each session has a tightly scoped, reviewable unit of work.",
  "target_outcome": "implementation_guide",
  "constraints": {
    "tech_stack": [
      "Node.js ESM",
      "Claude Code multi-agent harness (rig-bench repo)"
    ],
    "version_policy": "latest_stable",
    "must_include": [
      "concrete specs/ folder layout",
      "spec file template/frontmatter",
      "lifecycle states and naming convention",
      "how it maps onto existing todo.md backlog and workflows/*.js pipeline"
    ],
    "must_exclude": [
      "unrelated SaaS spec-management tools requiring external accounts",
      "heavyweight enterprise PM frameworks"
    ]
  },
  "depth": "moderate_detail",
  "validation_threshold": 0.85,
  "max_iterations": 5
}